{
  "schema_version": "1.0",
  "definition_id": "shopping-secret-backend",
  "owner": "MAC_MINI_M4_AICONTROLCENTER_CONTROL_PLANE",
  "backend_kind": "sops-age",
  "production_status": "NOT_DEPLOYED",
  "value_free": true,
  "materialization_implemented": false,
  "encrypted_payload": {
    "path": "deploy/shopping/secrets/shopping.enc.yaml",
    "required_owner": "control-plane-user",
    "maximum_mode": "0600"
  },
  "identity_custody": {
    "platform": "macos",
    "base": "control-plane-home",
    "relative_path": ".config/sops/age/keys.txt",
    "required_owner": "control-plane-user",
    "maximum_mode": "0600",
    "external_to_repository": true,
    "contents_inspected": false
  },
  "recipient_policy": {
    "minimum_recipients": 2,
    "roles": ["control-plane", "offline-recovery"],
    "recipient_material_stored": false
  }
}
